<?xml version="1.0" encoding="UTF-8"?>
<!--Sample XML file generated by XMLSpy v2017 rel. 3 sp1 (x64) (http://www.altova.com)-->
<VANIS xmlns:xsi="http://www.w3.org/2001/XMLSchema-instance" xsi:noNamespaceSchemaLocation="StammdatenSnrVS30Gepard.xsd">
	<VERSION value="01.00"/>
	<BEARBKZ value="I"/>
	<ZAEHLER value="1"/>
	<SNRSTAMM>
		<SNRSATZ>
			<SNR value="String"/>
			<ES1 value="String"/>
			<ES2 value="String"/>
			<SNRDRUCK value="String"/>
			<BENLANG value="a"/>
			<BENKURZ value="a"/>
			<BEREICH value=""/>
			<VERBRAUCHERORTE>
				<VO1 value="a"/>
				<VO2 value="a"/>
				<VO3 value="a"/>
				<VO4 value="a"/>
				<VO5 value="a"/>
				<VO6 value="a"/>
				<VO7 value="a"/>
				<VO8 value="a"/>
				<VO9 value="a"/>
				<VO10 value="a"/>
				<VO11 value="a"/>
				<VO12 value="a"/>
				<VO13 value="a"/>
				<VO14 value="a"/>
				<VO15 value="a"/>
				<VO16 value="a"/>
				<VO17 value="a"/>
				<VO18 value="a"/>
				<VO19 value="a"/>
				<VO20 value="a"/>
				<VO21 value="a"/>
				<VO22 value="a"/>
				<VO23 value="a"/>
				<VO24 value="a"/>
				<VO25 value="a"/>
				<VO26 value="a"/>
				<VO27 value="a"/>
				<VO28 value="a"/>
				<VO29 value="a"/>
				<VO30 value="a"/>
				<VO31 value="a"/>
				<VO32 value="a"/>
				<VO33 value="a"/>
				<VO34 value="a"/>
				<VO35 value="a"/>
				<VO36 value="a"/>
				<VO37 value="a"/>
				<VO38 value="a"/>
				<VO39 value="a"/>
				<VO40 value="a"/>
				<VO41 value="a"/>
				<VO42 value="a"/>
				<VO43 value="a"/>
				<VO44 value="a"/>
				<VO45 value="a"/>
				<VO46 value="a"/>
				<VO47 value="a"/>
				<VO48 value="a"/>
				<VO49 value="a"/>
				<VO50 value="a"/>
			</VERBRAUCHERORTE>
			<MERKMALE>
				<M1 value="a"/>
				<M2 value="a"/>
				<M3 value="a"/>
				<M4 value="a"/>
				<M5 value="a"/>
				<M6 value="a"/>
				<M7 value="a"/>
				<M8 value="a"/>
				<M9 value="a"/>
				<M10 value="a"/>
				<M11 value="a"/>
				<M12 value="a"/>
				<M13 value="a"/>
				<M14 value="a"/>
				<M15 value="a"/>
				<M16 value="a"/>
				<M17 value="a"/>
				<M18 value="a"/>
				<M19 value="a"/>
				<M20 value="a"/>
				<M21 value="a"/>
				<M22 value="a"/>
				<M23 value="a"/>
				<M24 value="a"/>
				<M25 value="a"/>
				<M26 value="a"/>
				<M27 value="a"/>
				<M28 value="a"/>
				<M29 value="a"/>
				<M30 value="a"/>
				<M31 value="a"/>
				<M32 value="a"/>
				<M33 value="a"/>
				<M34 value="a"/>
				<M35 value="a"/>
				<M36 value="a"/>
				<M37 value="a"/>
				<M38 value="a"/>
				<M39 value="a"/>
				<M40 value="a"/>
				<M41 value="a"/>
				<M42 value="a"/>
				<M43 value="a"/>
				<M44 value="a"/>
				<M45 value="a"/>
				<M46 value="a"/>
				<M47 value="a"/>
				<M48 value="a"/>
				<M49 value="a"/>
				<M50 value="a"/>
				<M51 value="a"/>
				<M52 value="a"/>
				<M53 value="a"/>
				<M54 value="a"/>
				<M55 value="a"/>
				<M56 value="a"/>
				<M57 value="a"/>
				<M58 value="a"/>
				<M59 value="a"/>
				<M60 value="a"/>
				<M61 value="a"/>
				<M62 value="a"/>
				<M63 value="a"/>
				<M64 value="a"/>
				<M65 value="a"/>
				<M66 value="a"/>
				<M67 value="a"/>
				<M68 value="a"/>
				<M69 value="a"/>
				<M70 value="a"/>
				<M71 value="a"/>
				<M72 value="a"/>
				<M73 value="a"/>
				<M74 value="a"/>
				<M75 value="a"/>
				<M76 value="a"/>
				<M77 value="a"/>
				<M78 value="a"/>
				<M79 value="a"/>
				<M80 value="a"/>
			</MERKMALE>
			<EMPF1 value="a"/>
			<EMPF2 value="a"/>
			<EMPF3 value="a"/>
			<EMPF4 value="a"/>
			<EMPF5 value="a"/>
		</SNRSATZ>
	</SNRSTAMM>
</VANIS>
