<?xml version="1.0" encoding="UTF-8"?>
<!--Sample XML file generated by XMLSpy v2017 rel. 3 sp1 (x64) (http://www.altova.com)-->
<VANIS xmlns:xsi="http://www.w3.org/2001/XMLSchema-instance" xsi:noNamespaceSchemaLocation="StammdatenSnrVS30Gepard.xsd">
	<VERSION value="01.00"/>
	<BEARBKZ value="I"/>
	<ZAEHLER value="2"/>
	<SNRSTAMM>
		<SNRSATZ>
			<SNR>SNR 1 Tag</SNR>
			<ES1>ES1</ES1>
			<ES2>ES2</ES2>
			<SNRDRUCK>SNRDRUCK</SNRDRUCK>
			<BENLANG>Ramy Feteha</BENLANG>
			<BENKURZ>RF</BENKURZ>
			<BEREICH>BEREICH</BEREICH>
			<VERBRAUCHERORTE>
				<VO1>VO1</VO1>				
				<VO2>VO2</VO2>
				<VO3>VO3</VO3>
			</VERBRAUCHERORTE>
			<MERKMALE>
				<M1>M1</M1>
				<M2>M2</M2>
				<M3>M3</M3>
			</MERKMALE>
			<EMPF1>EMPF1</EMPF1>
			<EMPF2>EMPF2</EMPF2>
			<EMPF3>EMPF3</EMPF3>
			<EMPF4>EMPF4</EMPF4>
			<EMPF5>EMPF5</EMPF5>
		</SNRSATZ>
		<SNRSATZ>
			<SNR>SNR 2 Tag</SNR>
			<ES1>ES1</ES1>
			<ES2>ES2</ES2>
			<SNRDRUCK>SNRDRUCK</SNRDRUCK>
			<BENLANG>Ahmed Mohamed</BENLANG>
			<BENKURZ>AM</BENKURZ>
			<BEREICH>BEREICH</BEREICH>
			<VERBRAUCHERORTE>
				<VO1>VO1</VO1>				
			</VERBRAUCHERORTE>
			<MERKMALE>
				<M1>M1</M1>
			</MERKMALE>
			<EMPF1>EMPF1</EMPF1>
			<EMPF2>EMPF2</EMPF2>
			<EMPF3>EMPF3</EMPF3>
			<EMPF4>EMPF4</EMPF4>
			<EMPF5>EMPF5</EMPF5>
		</SNRSATZ>
	</SNRSTAMM>
</VANIS>
